title,address,introduce,traffic_guide
桂林山水, 广西・桂林 桂林 ,"桂林的山，平地拔起，千姿百态；漓江的水，蜿蜒曲折，明洁如镜；山多有洞，洞幽景奇；洞中怪石，鬼斧神工，琳琅满目，于是形成了“山青、水秀、洞奇、石美”的桂林“四绝”，而自古就有“桂林山水甲天下”的赞誉。
桂林是一座文化古城。两千多年的历史，使它具有丰厚的文化底蕴。秦始皇统一思想国后，设置桂林郡，开凿灵渠，沟通湘江和漓江。桂林从此便成为南通海域，北达中原的重镇。宋代以后，它一直是广西政治、经济、文化的中心，号称“西南会府”，直到新中国建立。在漫长的岁月里，桂林的奇山秀水吸引着无数的文人墨客，使他们写下了许多脍炙人口的诗篇和文章，刻下了两千余件石刻和壁书，历史还在这里留下了许多古迹遗址。
千百年来，桂林一直是人们旅游观光的宝地。现在，一个以桂林市为中心，包含周围12个县的风景区已经形成。这里有浩瀚苍翠的原始森林，雄奇险峻的峰峦幽谷，激流奔腾的溪泉瀑布，天下奇绝的高山梯田......在这一片神奇的土地上，生活着壮、瑶、苗、侗、仫佬、毛难等十多个少数民族。大桂林的自然风光、民族风情、历史文化、深深地吸引着中外游客以及国家元首纷至踏来，流连忘返。
总体来说桂林最佳的旅游季节是每年的4月－10月，也就是通常所说的旅游旺季（总体的旅游价格比平时不会高很多，或者说没有差别）。五一、国庆、春节长假期间是旅游高峰期，各个景点都是人满为患，城市的道路显得非常的拥挤。
桂林作为一个旅游名城比起其他城市来说及其微小，城市人口不过70万。最主要的街道是中山路和解放路，最繁华的是中山路的一段－－中山中路，仅仅从中山中路的一头走到另一头，不用30分钟。晚上7点以后中山中路有一半的街道会成为步行街，让人感觉很热闹。
以下是外地游客还算关注的一些市内景点。
象鼻山 ★★★★
4A景点，桂林的城徽，价格也不是很高，还是值得一去的。是由3.6亿年前海底沉积的纯石灰组成的，远远看去真的很像是一大象把鼻子伸入水中，这里也是桂林旅游的标志性景点。园内还有摩崖石刻50余件，刻有陆游、范成大、张效祥等著名诗人的作品。
开放时间：淡季7：00―21：30      旺季6：30―22：00
门票：25元
交通：可选择乘坐免费公益车（57、58路），公交车（2、23路），景区穿梭巴士或自驾车直达景区。
欣欣旅游网小提示：摄影宜在坐船游漓江时取摄影角度，象山水月的夜景非常棒，酷爱摄影的朋友一定不要错过。游览时间通常一个半小时。
七星公园 ★★★★
桂林市内最大的公园。普陀山是七星公园的主山，其中最得一看的是颜真卿的逍遥楼，宋代范成大的《碧虚铭》，明代龟蛇合一的浮雕以及位于博望坪800壮士墓、三将军墓等。月牙山的桂海碑林也是不可错过的景点。
开放时间：景区 6：00――20：30    七星岩 8：30――17：30
门票：含七星岩65元/人（票价如变动,以门市公布价为准）
交通：公交车10路、11路、14路、18路、25路、30路、31路、98路、免费公益车52路、58路可达景区花桥大门
景区电话：0773-5814342
欣欣旅游网小提示：公园配有付费专职外景导游，可根据客人时间和需求设计最佳游览线路。七星岩游览时间约45分钟，整个公园约2个小时。
叠彩山 ★★★
叠彩山因山上石层横断间层层如绸缎相叠而得名。主峰是“明月峰”，在峰顶俯览群山，可山中岩石层层相叠，山花竟相怒放，方有感此山何谓“叠彩”。山顶看桂林全景还是不错的。
开放时间：淡季7：00―18：30       旺季6：30―18：30
门票：20元
交通：公交2路、免费58路可以到公园大门。
芦笛岩 ★★★
4A景点，知名度太高，价格也太高，岩洞的人工痕迹太多，洞内有一个唯一有水面的景致是很不错的。
游览时间：约1小时
门票：60元
交通：距市中心约3公里，可乘3路公交车、免费58路直达。
靖江王府 ★★★
住过12代14个藩王，是明太祖朱元璋的侄孙朱守谦被封为靖江王的王府。“桂林山水甲天下”这一场四海的名句，就是出自王府内独秀峰的宋代石刻。
开放时间：09：30～17：30
门票：50元
交通：1、10、18、22、24路公交车及51、57路免费公交车。
景区电话：0773-2852203
欣欣旅游网小提示：全游程需3小时。上独秀峰的石阶很陡，上下要特别小心。
两江四湖(环城水系) ★★★★
市内环形水上游览线路，两江四湖指漓江、桃花江、木龙湖、桂湖、榕湖、杉湖。一个免费开放的市内公园，晚上的夜景很漂亮
游览时间：乘船游览时间90分钟左右。
门票：149元/人（普通船），155元/人（空调船）
交通：杉湖知音台码头位于桂林国际旅行社北侧，乘2、23路公交车到象山公园站下车可抵达。 文昌桥码头位于文昌桥东南端桥底（华亭食府后面），乘23、16、2路公交车到文昌桥站下车可抵达。解放桥六匹马码头位于解放桥东南端桥底，该处有六匹铜马为标识，乘11、31、10、14、18路公交车可抵达。
景区电话：0773-2837666
欣欣旅游网小提示：船票在滨江路桂林国旅一楼、桂林大世界大厦一楼等处购买。其实绕着桂湖、榕湖、杉湖步行也蛮好的，不花钱。
景点介绍


阳朔主要景点介绍：
1.世外桃源 ★★★
门票：50元。4A景点，导游员的素质不错，感觉有点贵，不够自然。距离市中心48公里，游览时间45分钟。
2.山水园 ★★
门票：30元 。门票贵了，早晚进去免费的。游览时间约1小时，阳朔水东门码头上面。
3.印象刘三姐 ★★★★
门票：188元 。张艺谋导演的确实不同，场面宏大，除去价格因素以外是非常不错的，男士一定不要忘记带上望远镜。游览时间约60分钟，县城乘坐电平车1元可以到。
4.大榕树 ★★
门票：18元 。就看这一颗树，太不值了，价格高了。距县城7公里，游览时间30分钟
5.月亮山 ★★★★
门票：18元 。阳朔必游景点，很好的攀岩场所。距县城7.3公里，游览时间 1小时

有这样一句话：No bike trip!No Yangshuo!不了解的人投诉是吹牛，但这的确是到阳朔旅游的""驴友们""的心声，最先，bike是来阳朔旅游的背包老外所最愿意采用的，等到国内的驴友们来到阳朔时，也迷上了这种旅游方式。租上一辆自行车，只要时间允许，您可尽兴地走村访寨，或独自闲游，或结伴同行，轻便快捷，自由自在，无拘无束。特别是弄上一辆双人（或三人）座自行车""招摇过市""，更是浪漫哦！更何况骑自行车也是最经济的方式。在西街租一辆不错的自行车每天的租金大约10元左右,和朋友或情人轻松骑遍县城周边的乡村田野,或许这次旅行就能成为你一生不朽的体验。
骑行线路推荐
骑行路线1：阳朔－大榕树－月亮山－月亮山村－釜山寺－燕村－田家河－阳朔
骑行距离：约20公里，有公路和乡村小道
路线特点：经典的骑行路线，有阳朔最好的山水风景、田园风光和牧童水牛
体力要求：非常休闲，适合一般体力的旅行者
从阳朔出发，沿着阳朔到荔浦的公路骑行20分钟可到工农桥，工农桥一边是景点""骆驼过江""，一边是遇龙河和金宝河的交汇处，两边的景色都美不胜收。
沿公路前行约500米就是大榕树景区，门票18元。从大榕树前行约1公里就到了著名的月亮山，从月亮山左拐，骑过赏月路就是月亮村，村子是观赏月亮山的绝佳位置，近些年村民开设了许多家庭旅馆和饭店，供旅行者休息和午餐。在农家院中边吃饭边观赏月亮山，那绝对是个不错的选择 。
饭后沿原路返回到公路，沿釜山寺前的乡间小路前行，过一座石拱桥就是燕村，燕村村口有小卖部，有各种饮料出售，稍微休息一下继续前行，就道了景风极好的田家河，你可以把单车靠在路边，下到田家河的水坝上看风景。一般到此时已是下午，田家河的日落是非常吸引人的，静静的河水，走过水坝的牛群，在夕阳的映照下显得祥和而从容。
前行就矮山了，出了矮山就是公路，沿公路骑行5公里就可回到阳朔。
骑行路线2：阳朔－工农桥－河边小别墅－阳朔胜地－同门岩－风楼村－月亮山－大榕树－阳朔
骑行距离：路程来回近20公里
路线特点：基本围绕大榕树景区
体力要求：非常休闲，适合一般体力者
从阳朔出发到工农桥后右拐，前行500米可到河边小别墅，这是个由过去抽水站改建的小旅馆，前面是遇龙河，有很多个竹排停在水边，有条拦河坎一直通到田野里，视线非常开阔，临河的阳台上摆着桌椅，可以边品着5元一壶的茶，边欣赏风景。
推车从拦河坝上过河，或是从右岸沿河边小路前行，竹林很多，前行1公里可到阳朔胜地，从阳朔胜地午饭后，花1到2元钱可到对岸（枯水的季节也可以从拦河坝上走过），再顺着遇龙河边的小路前行，不到1公里可到同门岩攀岩点，每天都可以看到来自世界各地的攀岩者。山下有个天然的石洞穿过小山，里面有水泥做的长长的台子和凳子，是攀岩者用来休息的地方。从同门岩左拐沿山间小路前行500米可到月亮山后的凤楼村，沿公路往回走可回阳朔。
骑行路线3：阳朔－福利－车郎山－兴坪－石头城－葡萄－阳朔
骑行距离：单程约60公里，需两天完成。
路线特点：沿途田园风光不错，兴坪－葡萄一段路很难走，徒步和骑单车游客都很少
体力要求：对体力要求很高，适合经常骑单车越野的好手
早上从阳朔出发，沿观莲路前行10分钟可到阳朔大桥，阳朔大桥附近是看县城及碧莲峰的好地方，右手边的书童山，也是阳朔精典的风光。过隧道后半小时可到福利古镇，古镇江边的风光不错，并有数条老街可细细品味，镇上有不少做大扇子的作坊可参观。
出古镇左拐就是去兴坪的公路，前行20分钟可见东郎山，右边是车田风光，往前经古风亭、西山，约3小时可到兴坪古镇，游览兴坪老街，在码头附近吃午饭，靠码头有几家专为旅客设置的小饭店，中西餐都有，邮电招待所附近有几家大排挡不错，较那些专为游客准备的小饭店便宜一些。
码头旁的老山寨是个观光兴坪美景的好地方，爬到山顶需半个小时，坐在山顶观日出是个不错的选择。走过兴坪大桥前行500米的朝板山房也是个观光风景的好地方，夏天会有很多的人在此游泳。
晚上可宿兴坪休整，码头上有几家小旅馆，一般价格在20~50元，条件不错，码头对面的大河背村有家农庄也很不错，住宿费每人约10元。
第二天一早看完兴坪日出，连车带人坐摆渡到过对岸的大河背村，沿村中的小路骑行20分钟可螺狮岩，然后过大洲岭，开始推车上山，脚下是清代古道，石板石城，约1公里，走完这段清代古道就到了黄泥田，从黄泥田，村往上也是缓缓的上山泥路，平缓的地方可以骑行。半个多小时可到大岭头，村旁的荷苞山是个观风景的好地方，登上约200米高的荷苞山，漓江山水的精华""黄布倒影""及""九马画山""就在脚下不远的地方，著名的""下龙风光""也可在此处欣赏。
从大岭头村到古石头城都是山间耕路，道路忽上忽下，2个小时可到。石头城到葡萄约7公里，需骑行大约1个多小时，接近下山的时候景色不错，开阔的田野，春天可看到一眼望不到边的油菜花，秋季可看到金黄的稻田。
到葡萄就到可桂阳公路，顺着公路过世外桃源、五里店、白沙可回到阳朔。
从桂林到阳朔，可以在桂林火车站南广场坐到阳朔的班车，6：30～21：30，每15分钟一班，票价10元。或者在桂林汽车总站乘快巴车，票价13元。从阳朔到桂林市区，可以有两种选择，一是乘坐私营的中巴，10元，中间兜客，到桂林火车站，一是坐公营的中巴，13元，直达桂林汽车站。
从广州、深圳、梧州等地也有到阳朔的长途卧铺客车，豪华车到深圳220元左右，到广州150元左右，普通车便宜些，时间大约在10小时左右。
阳朔汽车站 地址：阳朔县蟠桃路 电话：0773－8822188
水运
桂林至阳朔的漓江旅游船每天都有，时间一般为9：00～10：00，从磨盘山码头、竹江码头乘船，行程4小时左右到达阳朔。
住宿情况:
阳朔住的地方很多，但最好是住在西街，其次就是县前街，这两条街上的酒店、客栈一间连一间，只要自己喜欢，可以一家一家进去看，或者一家住一个晚上，不管哪一家都能带来舒适和愉快。
如果有大把时间，甚至可以在阳朔的小巷中找一处家庭旅馆，租一个月也只有500元，推开窗子就是西街的热闹，掩上门又可以安静地入睡。旅游小贴士
场馆表演内容：
1、海洋剧场潜水表演：五环奥运、嫦娥奔月、美人鱼、喂鱼
时间为每天9:00，10:00，11:00，14：30，15：30，16：30
2、动感4D影院：惊险刺激的特种动感电影，每场15-20分钟，随机播放。
",飞机，公路，铁路，水运都可以到达桂林。
桂林市漓江景区, 广西・桂林 广西桂林市象山区安新北路727栋 ,"桂林漓江风景区是世界上规模最大、风景最美的岩溶山水游览区，千百年来它不知陶醉了多少文人墨客。桂林漓江风景区以桂林市为中心，北起兴安灵渠，南至阳朔，由漓江一水相连。桂林山水向以“山青、水秀，洞奇”三绝闻名中外。桂林漓江风景区游览胜地繁多，在短期内只能择其主要景点进行游览，其中一江（漓江）、两洞（芦笛岩、七星岩）、三山（独秀峰、伏波山、叠彩山）具有代表性，它们基本上是桂林山水的精华所在。旅行社组织的桂林两日游，一般是第一天游独秀峰、叠彩山、伏波山、七星岩和芦笛岩；第二天起由漓江去阳朔。
【漓江景点】
象鼻山：
象鼻山在桂林市的漓江与桃花江汇流处，山似伸着长鼻在江边饮的大象。明孔镛《象鼻山》诗云：“象鼻分明饮玉河，西风一吸水应波。青山自是绕奇骨，白日相看不厌多。”象鼻下有水月洞，山上有明代新建普贤塔。
訾洲：
訾洲在象鼻山对岸，为漓江和支流间的沙洲。烟雨空蒙之时，訾洲如盖皱纱。“訾洲烟雨”为“桂林八景”之一。唐朝桂曾观察使斐行立，在洲上修筑亭台楼阁，营造风景，盛极一时。文学家柳宗元应请作《訾家洲亭记》，对桂林之山作了生动的描写：“桂州多录山，岁地峭竖，林立田野。”
斗鸡山
斗鸡山在漓江东岸的穿山与西岸的龟山，形如隔江相斗的两只雄鸡，合称斗鸡山。观赏斗鸡山，须待游船行过，回首观望。
净瓶山
净瓶山在漓江右岸一山，像半边古式瓷瓶，倒卧江中，被江水洗濯十分洁净，固名净瓶山。春夏水涨，倒映江中，山影相接，浑然一体，古朴雅致
父子岩：
在漓江与良丰江汇流处有一山，名父子岩，洞中有块巨石，像光头老人的是父亲，洞口一小石似小孩的是儿子，传说他们父子不愿为财主造船，躲避洞中，日久化为石化。
卫家渡
卫家渡在漓江东岸，原为主要渡头，公路桥建成后渐废。卫家渡土地肥沃，土质松软，宜种马蹄。品格最高的，色红、形扁、蒂短、皮薄、味甜、汁多、无渣，可生吃也可熟吃，远销世界各地。“桂林马蹄”名闻遐迩，主要产地在卫家渡。
奇峰镇：
奇峰镇镇外奇峰林立；剑戟千重，诗云：“奇峰镇外看奇峰，万点尖峰锁碧空，”群峰之中，高峰上有一个透明大洞，是传说中伏波将军“一箭穿三山”所射穿的第二个洞，像是月亮挂在山上，称为奇峰挂月。
黄牛峡：
船往下行，迎面九个山峰像九头黄牛，此处名黄牛峡。这些山峰，像给雷劈去了半边，故又叫雷劈山；再看这些雷劈似的山峰，又若展翅欲飞的蝙蝠。因此亦叫蝙蝠山。从这里开始，两岸石山连绵，峰峦耸峙。
猫儿山
那是个林丰木秀，空气清新，生态环境极佳的地方。漓江上游主流称六峒河；南流至兴安县司门前附近，东纳黄柏江，西受川江，合流称溶江；由溶江镇汇灵渠水，流经灵川、桂林、阳朔，至平乐县恭城河口称漓江；下游统称桂，至梧州市汇入西江，全长约437公里，流域面积约5585平方公里。从桂林到阳朔约83公里的水程，堪称漓江精华。
【刘三姐相关传说】
相传刘三姐为唐代壮族农家女，年幼聪颖过人，被视为“神女”。十二岁能通经传，指物索歌，开口立就。自编自唱，歌如泉涌，优美动人，不失音律，故有“歌仙”之誉。十五岁时聘于林氏，唐开元十年（722年），为抗拒林氏逼婚，与情人张伟望出奔，不知所终。民间多以为双双成仙而去。广西宜山壮族传说，刘三姐生于唐中宗神龙元年（705年），从小聪慧过人，能歌善唱。12岁即出口成章，妙语连珠，以歌代言，名扬壮乡。后曾到附近各地传歌。慕名前来与她对歌的人络绎不绝，但短则一日，长则三五天，个个罄腹结舌，无歌相对，无言以答，羞赧而退。然而她的才华却遭到流氓恶霸的嫉恨，后被害死于柳州。传说她死后骑鲤鱼上天成了仙。也有的说她在贵县的西山与白鹤少年对歌七日化而为石。还有的说财主莫怀仁欲娶她为妾，三姐坚决反抗，莫怀仁买通官府迫害三姐，三姐乘船飘然而去，等等。

","1、普通船到阳朔龙头山码头下，豪华船和超豪华船在阳朔碧莲峰码头下。
2、如果自行购票，市区没有公车到码头，只有早上打的前往，出租车费用70元左右。"
桂林宋城千古情, 广西・桂林 广西桂林市阳朔县千古情大道 ,"由宋城演艺和桂林旅股联合打造的桂林千古情景区，再现了桂林的历史文化与民族风情，老少同乐、晴雨皆宜。核心演出大型歌舞《桂林千古情》是一生必看的演出，视觉盛宴，心灵震撼，唱响了一曲感天动地的桂林千古传奇。
景区一切以游客为中心，拥有上万平米全室内空调开放的3号秘境旅游综合体、风雨廊、五星级标准洗手间。巨型歌仙造像气势宏伟，与桂林山水融为一体，是八桂大地真善美儿女的化身。景区内鬼屋、清明上河图电影馆、奇妙街等数十项高科技和儿童体验项目妙趣横生。阳朔古村营造了独特的农耕市井生活风貌，市井街、风情街内爷爷的酒缸、奶奶的糕点、爸爸的玩具等手工作坊留住乡愁、寻找父辈的记忆。东街云集了湘菜、粤菜等全国特色美食和小吃。情人港、4号海湾是年轻人休闲的好去处。不能错过的就是精彩指数七星级的大型歌舞《桂林千古情》，还有六星级的5D实景剧《大地震》，以及《锅庄狂欢》等数十大演艺秀和科技秀，感受一场文化与科技的饕餮盛宴，让你流连忘返。
还有即将开放的不夜城酒吧街，与千古情景区一起成为阳朔真正的不夜城，给我一天，还你千年！
",NA
广西北海, 广西・北海 广西壮族自治区北海市 ,"广西壮族自治区北海，位于广西最南端，北部湾东北岸，北海是一个浪漫的城市，风光旖旎，气候宜人，让人流连忘返。它还是一座具有亚热带滨海风光的美丽城市，拥有中国优秀旅游城市的称号。
北海是中国南部海滨的一座美丽的花园城市，道路宽阔笔直，绿树成荫，碧蓝的大海，明媚的阳光，沙白水净的海滩，中西合壁、华洋并存的市区建筑，环境优美的住宅小区，别具风格的绿化广场，大自然优厚的馈赠为这里钩画了一幅美丽的画卷。城市居民淳朴友好，珠乡文化、客家文化、蛋家文化形成了鲜明的地方文化风貌。
北海地处亚热带，阳光充沛，雨量充足，植被丰茂。全年花繁叶绿，四季瓜果飘香。自然环境得到很好的保护，大陆和海岛沿岸有众多天然优良海滩，海水温净碧透，浪软如毯，自净力强。水质为国家一级标准。北海空气的清新可谓全国之最，在全国各城市中居优级领先地位。是中国可适宜居住城市的“三海一门”（即珠海、北海、威海、厦门）中的一海。可称得上是免费的氧吧。
北海拥有北海银滩国家旅游度假区和涠洲岛、星岛湖两个省级旅游度假区、观涛岭国家森林公园、山口国家红树林自然保护区、美人鱼国家自然保护区、白龙珍珠城遗址、合浦汉代墓葬保护区、大士阁、东坡亭、欧美领事馆旧址等一大批景点，集“海、滩、岛、湖、林、山、古迹、人文”于一体。北海银滩被国家列为中国五个最美度假胜地之一。广西则以“北有桂林山水，南有北海银滩”而自豪。
北海印象
海上丝绸之路
“海上丝绸之路”是古代中国与外国交通贸易和文化交往的海上通道。关于这条海上贸易线路的起点一直争议不断。史书记载，2000多年前的汉代，就有由“黄门”宦官和译长率领、私商应募参与的“官方”船队，从北部湾北海市现辖下的合浦等地出发，沿中南半岛海岸，经南洋抵达印度洋，进入中亚。北海在遥远的两汉时代就成为中国对外开放的前沿地带，成为传播中华文明和中外经济文化交流的重要门户。作为最早的“海上丝绸之路”始发港，在北海市合浦县城廉州镇周边，至今仍保存着近万座汉墓。随着历史变迁，“海上丝绸之路”始发港逐渐东移，广州、泉州、宁波等地因为大量贸易活动的史料发现及城市发展规模，成为“海丝”始发港的当然“代表”。
2011年，北海加入了“海上丝绸之路”世界遗产申报城市的行列，与广州、漳州、泉州、宁波、扬州、蓬莱等6城市建立了中国“海上丝绸之路”7城市文化遗产研究、保护、利用和联合申遗工作联席会议机制。
涠洲风情
找一个岛，太阳起得不太早，同行的陌生朋友，醒来连名字都不知道；
找一个岛，月亮爬得不太高，谈天、喝酒、说笑，还有螃蟹围着客厅跑；
找一个岛，走路走到快睡着，偶尔想被人打扰，只有牛过小路在吃草.....
有一个岛，北部湾上找得到，阳光、沙滩、海水，还有珊瑚和海草；
有一个岛，火山熔岩景观好，万年前波涌出，还有依依相伴斜阳岛；
有一个岛，哥特教堂是国宝，三婆圣庙神韵在，还有龟豕拱碧迎客到；
有一个岛，北部湾上涠洲岛，南海碧波镶翡翠，真是人间蓬莱天下少！
海上“吉普赛人”
北海的D民是个特殊的群体，他们以前大多居住在小舟上，以舟楫为家，舟小如D，故称D民。有的人类学家认为他们是古越族的后代，因为常年漂泊海上,他们被称为海上的“吉普赛”人。
对于“D”这个名城的来历，D家人表示，这是因为他们常年与风浪搏斗，生命难以得到保障，如同蛋壳一般脆弱，故称为D家。D民和客家人一样，他们漂泊、迁徙、避世。不过，客家人躲进深山老林，而他们则隐身于汪洋大海。
D民没有统一的语言，有部分D民仍保留原祖籍的语言，部分地区的D民语言与当地居民同化，已没有独立语言。D民风俗习惯与当地汉族相同，宗教信仰为佛教，但他们更信奉龙皇，初一、十五都会上香，并且非备猪、羊奠祀不可，祈求神明保佑他们平安、幸福。
",飞机：北海福成机场距离市区24公里，到北京、上海、长沙、武汉、深圳、昆明、重庆、成都、广州、郑州、桂林、杭州、海口、梧州、珠海等都有航线，铁路：有南宁到北海往返专列，公路：北海共有4个汽车站，汽车总站最大最规范，二运和客运中心有少量车，西区客运服务站多走广东北海市。，火车：北海铁路只开通北海―南宁的往返列车，一般到北海选择列车的话，都是先乘火车到南宁，再转车到北海。目前南宁已开通直达北海的快速列车，行程约三小时，南宁直达北海的快速列车，发车时间在早上九点和下午两点左右。
